[
  {
    "id": 2,
    "title": "VPN drops every ~20 minutes",
    "slug": "vpn-drops-every-20-minutes",
    "priority": "high",
    "status": "open",
    "assignee_id": null,
    "created_at": "2026-08-08T10:02:11.004552",
    "closed_at": null
  },
  {
    "id": 1,
    "title": "Printer on 3rd floor is jammed",
    "slug": "printer-on-3rd-floor-is-jammed",
    "priority": "med",
    "status": "closed",
    "assignee_id": null,
    "created_at": "2026-08-08T09:14:02.331201",
    "closed_at": "2026-08-08T09:20:47.881033"
  }
]
